{
  "apiVersion": "nexus.io/v1alpha2",
  "kind": "EditionDeclaration",
  "metadata": {
    "instance_id": "inst_costahomes01",
    "edition": "team",
    "generated_at": "2026-07-19T09:00:00Z"
  },
  "spec": {
    "capabilities": ["team_collaboration", "fleet_management", "premium_pack_access"],
    "source": "verified_entitlement",
    "entitlement_ref": {
      "revision": 14,
      "expires_at": "2026-08-01T00:00:00Z"
    },
    "subscription_state": "active"
  }
}
